{"acquisition_allowlist":["config.json","preprocessor_config.json","configuration_MERT.py","modeling_MERT.py","pytorch_model.bin"],"acquisition_mechanism":"huggingface_hub.snapshot_download","acquisition_version":"0.36.0","fairseq_checkpoint_status":"NOT_ACQUIRED_NOT_CONSUMED","files":[{"relative_path":"config.json","role":"MODEL_CONFIG","sha256":"ea2627c4c7825cd66f3c944b6b966331604c35928174e0100cd4a82829424e32","size_bytes":1817},{"relative_path":"configuration_MERT.py","role":"CUSTOM_CONFIGURATION_CODE","sha256":"ae0ec2bab8f59c724ba9878a7c20b67210189536ea62d34a56775968e9decb03","size_bytes":5340},{"relative_path":"modeling_MERT.py","role":"CUSTOM_MODELING_CODE","sha256":"6c3ee73cef6f0c30ef494f88d96f891fa6925ffe663fa391b512f4b57abecc6c","size_bytes":18033},{"relative_path":"preprocessor_config.json","role":"PREPROCESSOR_CONFIG","sha256":"cc5a5e4a5d3b1a758a5ed984b2eaa15bb0522d811d44a9eed82bfca4baa0dc8f","size_bytes":211},{"relative_path":"pytorch_model.bin","role":"CANONICAL_TRANSFORMERS_WEIGHT","sha256":"a2b8b747f72c06e0595aeae41ae5473f4364938c6b39b2c58be38c48e6bd3fcd","size_bytes":377552987}],"inventory_sha256":"b3949c54c69eb3d1a67ef777534feb350bf0d61375cb8479833e278936af1bb4","model_root_runtime":"D:\\SC-MV-DMER-data\\upstream_models\\mert-v1-95m\\12af15fef9d0ac838c3f475bfbbf26d2060dd4f5","repository_id":"m-a-p/MERT-v1-95M","required_files_complete":true,"revision":"12af15fef9d0ac838c3f475bfbbf26d2060dd4f5","schema_version":"1.0","snapshot_aggregate_sha256":"07269a149bcedb98f6c0cd9bc11719c4e0571f06e4fe41599536cd180812b80c","supersedes":"reports/preflight/mert-primary-local-status-v3.json"}
